<?xml version="1.0" encoding="UTF-8" standalone="no"?>
<!DOCTYPE menu SYSTEM "menu.dtd">

<menu precio="" horario="">
	<entrantes>
		<producto>
			<id></id>
			<nombre></nombre>
			<descripcion></descripcion>
			<alergenos></alergenos>
			<precio></precio>
		</producto>
		<producto>
			<id></id>
			<nombre></nombre>
			<descripcion></descripcion>
			<alergenos></alergenos>
			<precio></precio>
		</producto>
	</entrantes>
	<primeros>
		<producto>
			<id></id>
			<nombre></nombre>
			<descripcion></descripcion>
			<alergenos></alergenos>
			<precio></precio>
		</producto>
	</primeros>
	<segundos>
		<producto>
			<id></id>
			<nombre></nombre>
			<descripcion></descripcion>
			<alergenos></alergenos>
			<precio></precio>
		</producto>
		<producto>
			<id></id>
			<nombre></nombre>
			<descripcion></descripcion>
			<alergenos></alergenos>
			<precio></precio>
		</producto>
	</segundos>
	<postres>
		<producto>
			<id></id>
			<nombre></nombre>
			<descripcion></descripcion>
			<alergenos></alergenos>
			<precio></precio>
		</producto>
		<producto>
			<id></id>
			<nombre></nombre>
			<descripcion></descripcion>
			<alergenos></alergenos>
			<precio></precio>
		</producto>
	</postres>
	<bebidas>
		<producto>
			<id></id>
			<nombre></nombre>
			<descripcion></descripcion>
			<alergenos></alergenos>
			<precio></precio>
		</producto>
		<producto>
			<id></id>
			<nombre></nombre>
			<descripcion></descripcion>
			<alergenos></alergenos>
			<precio></precio>
		</producto>
	</bebidas>
</menu>